{
  "$schema": "http://json-schema.org/draft-07/schema#",
  "$id": "https://github.com/pkirsanov/bubbles/schemas/scenario-manifest.schema.json",
  "title": "Bubbles scenario-manifest.json (v5.1 / M9)",
  "description": "Per-spec scenario-contract manifest. Lives at specs/<feature>/scenario-manifest.json. Records every Gherkin scenario with required-test-type, linked tests, evidence references, and lockdown status. Read by state-transition-guard.sh Check 3C (Gate G057).",
  "type": "object",
  "required": ["schemaVersion", "scenarios"],
  "additionalProperties": true,
  "properties": {
    "schemaVersion": { "type": "integer", "const": 1 },
    "spec": { "type": "string" },
    "generatedAt": { "type": "string", "format": "date-time" },
    "scenarios": {
      "type": "array",
      "items": {
        "type": "object",
        "required": ["id", "title", "requiredTestType"],
        "additionalProperties": true,
        "properties": {
          "id": {
            "type": "string",
            "pattern": "^SCN-[A-Z0-9]+-[0-9]+$",
            "description": "Stable scenario identifier (e.g. SCN-042-001). Persists across reword/renumber."
          },
          "title": { "type": "string", "minLength": 1 },
          "requiredTestType": {
            "type": "string",
            "enum": ["unit", "functional", "integration", "ui-unit", "e2e-api", "e2e-ui", "stress", "load"],
            "description": "Canonical test taxonomy classification — see agent-common.md."
          },
          "scopeRef": { "type": "string" },
          "linkedTests": {
            "type": "array",
            "items": { "type": "string" },
            "description": "Paths or test identifiers proving this scenario."
          },
          "evidenceRefs": {
            "type": "array",
            "items": { "type": "string" },
            "description": "report.md anchors or tool-log session ids with raw output."
          },
          "lockdown": {
            "type": "object",
            "additionalProperties": true,
            "properties": {
              "state": { "type": "string", "enum": ["unlocked", "locked", "invalidated", "replaced"] },
              "approvedBy": { "type": "string" },
              "approvedAt": { "type": "string", "format": "date-time" },
              "replacedBy": { "type": "string" }
            }
          },
          "tags": { "type": "array", "items": { "type": "string" } },
          "behaviorTraits": {
            "type": "array",
            "items": {
              "type": "string",
              "enum": [
                "pure-calculation",
                "user-visible-ui",
                "api-contract",
                "mutable-state",
                "degraded-state",
                "shared-consumer",
                "dependency-path",
                "responsive-accessible",
                "sla-sensitive"
              ]
            },
            "description": "OPTIONAL (IMP-040 SCOPE-3, COV-9). The behavior traits this scenario actually has. bubbles.plan DERIVES the obligation set from these — see test-core.md 'Scenario Obligation Matrix'. Attaching every trait to every scenario is the failure mode this replaces, not a safe default: an always-identical set carries no information. Advisory and no-op unless declared; NOT part of required."
          },
          "obligations": {
            "type": "array",
            "items": {
              "type": "object",
              "required": ["trait", "requiredProof"],
              "additionalProperties": true,
              "properties": {
                "trait": { "type": "string" },
                "requiredProof": { "type": "string", "minLength": 1 },
                "satisfiedBy": {
                  "type": "array",
                  "items": { "type": "string" },
                  "description": "linkedTests references that discharge this obligation."
                }
              }
            },
            "description": "OPTIONAL (IMP-040 SCOPE-3, COV-9). The proof each declared behaviorTrait owes. One trait can imply several obligations, and a visible-UI assertion does not discharge a dependency-path one."
          },
          "implementationRefs": {
            "type": "array",
            "items": { "type": "string" },
            "description": "OPTIONAL (IMP-040 SCOPE-9, REG-8). Repository-relative paths of the code path this scenario governs, plus the consumer surfaces it is observed through. Changed-spec validation intersects these with the diff so a change to a shared consumer marks every affected certified scenario for revalidation. Never inferred from filenames alone."
          },
          "testMechanism": {
            "type": "object",
            "additionalProperties": true,
            "required": ["entrypoint", "inputOrigin", "assertionSurface", "dependencyPath"],
            "description": "OPTIONAL (IMP-040 SCOPE-4, COV-10). HOW the linked test reaches and observes the behavior. The category label alone cannot prove path fidelity: an e2e-ui test can assert against hidden legacy DOM or invoke a renderer directly and still carry the label. The first four fields use CLOSED vocabularies so a claim is checkable rather than prose.",
            "properties": {
              "entrypoint": {
                "type": "string",
                "enum": ["production-route", "production-api", "production-cli", "public-function", "detached-renderer", "internal-helper"],
                "description": "Where the test enters the system. `detached-renderer` proves a renderer unit, NOT route integration."
              },
              "inputOrigin": {
                "type": "string",
                "enum": ["live-provider", "ephemeral-real", "seeded-store", "synthetic-cache", "synthetic-fixture", "recorded-fixture"],
                "description": "Where the input comes from. Synthetic input may prove deterministic business logic; it cannot prove live acquisition."
              },
              "assertionSurface": {
                "type": "string",
                "enum": ["visible-ui", "accessibility-tree", "http-response", "persisted-state", "returned-value", "hidden-dom", "internal-state"],
                "description": "What the test asserts against. `hidden-dom` and `internal-state` may prove an internal projection, NOT a visible outcome."
              },
              "dependencyPath": {
                "type": "string",
                "enum": ["not-applicable", "ephemeral-real", "same-origin-real", "external-live", "synthetic-boundary", "cache-only"],
                "description": "Which dependency state the test exercises. Shared vocabulary with the SCOPE-6 dependency-path coverage rules."
              },
              "productionOwners": {
                "type": "array",
                "items": { "type": "string" },
                "description": "Repository-relative paths (and optional symbols when a code-index adapter is configured) of the production code that computes the asserted result."
              },
              "negativeControl": {
                "type": "string",
                "minLength": 1,
                "description": "The specific perturbation that makes this test fail. A test with no stated negative control has not been shown to be sensitive to the behavior it claims to prove."
              }
            }
          },
          "invariantRefs": {
            "type": "array",
            "items": {
              "type": "string",
              "pattern": "^INV-[A-Z0-9-]+$"
            },
            "description": "OPTIONAL (IMP-106 SCOPE-3, DOM-LINEAGE). Domain-invariant ids from domainModel.invariants[].id (e.g. INV-REFUND-ONCE) that this scenario exercises. Links each SCN-* to the static business invariant(s) it proves, so lineage is answerable both directions (which test proves invariant X / which requirement justifies this scope). Advisory and no-op unless the repo declares a domainModel: block; NOT part of required."
          }
        }
      }
    }
  }
}
